{
  "entry_id": "staging:weak-coupling-tfim-picture",
  "title": "Weak-coupling TFIM picture",
  "summary": "Use the bounded TFIM benchmark as weak-coupling route intuition only, not as a final theory claim.",
  "candidate_unit_type": "concept",
  "trust_surface": "staging",
  "status": "staged",
  "tags": [
    "tfim",
    "physical-picture",
    "weak-coupling"
  ],
  "source_refs": [
    "discussion:codex-session"
  ],
  "assumptions": [],
  "scope_note": "",
  "topic_slug": "",
  "created_at": "2026-04-08T06:57:25+00:00",
  "updated_at": "2026-04-08T06:57:25+00:00",
  "created_by": "aitp-cli",
  "notes": ""
}
